<festivalData
        xmlns:xsi="http://www.w3.org/2001/XMLSchema-instance"
              xsi:noNamespaceSchemaLocation="validation.xsd">
    <festival id="FEST-2026">
        <identity>
            <name>CodeConnect 2026 - IT networking festival</name>
            <edition>0. ročník</edition>
            <location>
                <city>Praha</city>
                <district>Troja</district>
                <venueName>Loděnice Troja</venueName>
                <country>CZ</country>
            </location>
        </identity>

        <dates>
            <startDate>2026-08-21</startDate>
            <endDate>2026-08-23</endDate>
            <timezone>Europe/Prague</timezone>
        </dates>

        <audience>
            <primary>Nadšenci do IT, kteří se chtějí zdokonalit v širším spektru oboru</primary>
            <secondary>Zájemci o oblast IT, kteří chtějí získat přehled o aktuálních trendech a možnostech kariérního rozvoje</secondary>
            <tertiary>Rodiny IT specialistů</tertiary>
            <language>cs</language>
        </audience>

        <formats>
            <format key="lecture">Odborné přednášky</format>
            <format key="workshop">Praktické workshopy</format>
            <format key="panel">Panelové diskuze</format>
            <format key="networking">Networking</format>
            <format key="concert">Koncert</format>
            <format key="dj-set">DJ set</format>
        </formats>

        <mission>
            Cílem festivalu je bourat stereotypy o IT komunitě a vytvářet prostor pro otevřený networking,
            sdílení zkušeností a profesní růst.
        </mission>

        <tickets>
            <startingFrom currency="CZK">400</startingFrom>
            <standard currency="CZK">600</standard>
            <vip currency="CZK">990</vip>
            <url>https://example.org/codeconnect/tickets</url>
        </tickets>

        <links>
            <website>https://example.org/codeconnect</website>
            <instagram>https://instagram.com/codeconnect</instagram>
            <linkedin>https://linkedin.com/company/codeconnect</linkedin>
        </links>

        <contact>
            <email>info@example.org</email>
            <phone>+420123456789</phone>
        </contact>
    </festival>

    <venues>
        <venue id="VEN-001">
            <name>Main Stage</name>
            <type>stage</type>
            <description>Keynote přednášky a hlavní přednáškové bloky.</description>
            <address>
                <street>Vodácká</street>
                <city>Praha</city>
                <postalCode>171 00</postalCode>
                <country>CZ</country>
            </address>
            <capacity>600</capacity>
            <accessibility>true</accessibility>
        </venue>

        <venue id="VEN-002">
            <name>Workshop Lab</name>
            <type>lab</type>
            <description>Hands-on workshopy (DevOps, cloud, etický hacking).</description>
            <address>
                <street>Vodácká</street>
                <city>Praha</city>
                <postalCode>171 00</postalCode>
                <country>CZ</country>
            </address>
            <capacity>120</capacity>
            <accessibility>true</accessibility>
        </venue>

        <venue id="VEN-003">
            <name>Panel Hall</name>
            <type>hall</type>
            <description>Panelové diskuze a debaty s hosty.</description>
            <address>
                <street>Vodácká</street>
                <city>Praha</city>
                <postalCode>171 00</postalCode>
                <country>CZ</country>
            </address>
            <capacity>250</capacity>
            <accessibility>true</accessibility>
        </venue>

        <venue id="VEN-004">
            <name>Networking Lounge</name>
            <type>lounge</type>
            <description>Networking zóny, partner booths, 1:1 meetups.</description>
            <address>
                <street>Vodácká</street>
                <city>Praha</city>
                <postalCode>171 00</postalCode>
                <country>CZ</country>
            </address>
            <capacity>300</capacity>
            <accessibility>true</accessibility>
        </venue>
    </venues>

    <performers>
        <performer id="PER-001">
            <name>Jan Novák</name>
            <country>CZ</country>
            <tags>
                <tag>AI</tag>
                <tag>engineering</tag>
            </tags>
            <bio>Vývojář zaměřený na aplikace strojového učení v praxi.</bio>
            <links>
                <website>https://example.org/jan-novak</website>
                <linkedin>https://linkedin.com/in/jannovak</linkedin>
            </links>
        </performer>

        <performer id="PER-002">
            <name>Team RedWire</name>
            <country>CZ</country>
            <tags>
                <tag>cybersecurity</tag>
                <tag>workshop</tag>
            </tags>
            <bio>Lektoři workshopů etického hackingu a bezpečnostních auditů.</bio>
        </performer>

        <performer id="PER-003">
            <name>Elena Rostova</name>
            <country>UA</country>
            <tags>
                <tag>data science</tag>
                <tag>big data</tag>
            </tags>
            <bio>Datová analytička a expertka na big data infrastrukturu.</bio>
        </performer>

        <performer id="PER-004">
            <name>Marcus Wright</name>
            <country>US</country>
            <tags>
                <tag>cloud</tag>
                <tag>architecture</tag>
            </tags>
            <bio>Senior Cloud Architekt s vášní pro serverless řešení.</bio>
            <links>
                <linkedin>https://linkedin.com/in/mwright-cloud</linkedin>
            </links>
        </performer>

        <performer id="PER-005">
            <name>Hiroshi Tanaka</name>
            <country>JP</country>
            <tags>
                <tag>IoT</tag>
                <tag>hardware</tag>
            </tags>
            <bio>Průkopník v oblasti Internetu věcí a smart cities.</bio>
        </performer>

        <performer id="PER-006">
            <name>Klára Dvořáková</name>
            <country>CZ</country>
            <tags>
                <tag>UX/UI</tag>
                <tag>accessibility</tag>
            </tags>
            <bio>Designérka se zaměřením na přístupnost webových aplikací pro všechny.</bio>
        </performer>

        <performer id="PER-007">
            <name>Ahmed Al-Farsi</name>
            <country>AE</country>
            <tags>
                <tag>fintech</tag>
                <tag>blockchain</tag>
            </tags>
            <bio>Specialista na decentralizované finance a bezpečnost chytrých kontraktů.</bio>
        </performer>

        <performer id="PER-008">
            <name>Sophie Martin</name>
            <country>FR</country>
            <tags>
                <tag>DevOps</tag>
                <tag>CI/CD</tag>
            </tags>
            <bio>Evangelistka pro automatizaci a kulturu DevOps v korporátním prostředí.</bio>
        </performer>

        <performer id="PER-009">
            <name>Tomáš Krejčí</name>
            <country>CZ</country>
            <tags>
                <tag>backend</tag>
                <tag>java</tag>
            </tags>
            <bio>Veterán vývoje v Javě, autor populárních open-source knihoven.</bio>
            <links>
                <website>https://example.org/tkrejci</website>
            </links>
        </performer>

        <performer id="PER-010">
            <name>Li Wei</name>
            <country>CN</country>
            <tags>
                <tag>mobile</tag>
                <tag>flutter</tag>
            </tags>
            <bio>Expert na multiplatformní mobilní vývoj a výkonnostní optimalizace.</bio>
        </performer>

        <performer id="PER-011">
            <name>Maria Silva</name>
            <country>BR</country>
            <tags>
                <tag>agile</tag>
                <tag>scrum</tag>
            </tags>
            <bio>Agile koučka, která pomáhá transformovat vývojové týmy k lepší efektivitě.</bio>
        </performer>

        <performer id="PER-012">
            <name>John Doe</name>
            <country>UK</country>
            <tags>
                <tag>open-source</tag>
                <tag>community</tag>
            </tags>
            <bio>Maintainer několika velkých open-source projektů pro Node.js.</bio>
        </performer>

        <performer id="PER-013">
            <name>Anna Kowalska</name>
            <country>PL</country>
            <tags>
                <tag>QA</tag>
                <tag>automation</tag>
            </tags>
            <bio>Lead QA Engineer se zaměřením na automatizované end-to-end testy.</bio>
        </performer>

        <performer id="PER-014">
            <name>David Černý</name>
            <country>CZ</country>
            <tags>
                <tag>gamedev</tag>
                <tag>unity</tag>
            </tags>
            <bio>Indie vývojář a tvůrce úspěšných mobilních her.</bio>
        </performer>

        <performer id="PER-015">
            <name>Chen Lu</name>
            <country>SG</country>
            <tags>
                <tag>AI</tag>
                <tag>nlp</tag>
            </tags>
            <bio>Výzkumnice v oblasti zpracování přirozeného jazyka a LLM modelů.</bio>
        </performer>

        <performer id="PER-016">
            <name>Fatou Diop</name>
            <country>SN</country>
            <tags>
                <tag>web3</tag>
                <tag>engineering</tag>
            </tags>
            <bio>Architektka decentralizovaných aplikací a Web3 evangelistka.</bio>
        </performer>

        <performer id="PER-017">
            <name>Hans Müller</name>
            <country>DE</country>
            <tags>
                <tag>SRE</tag>